{
  "id": "mission.msr03_ferrum_anomaly",
  "version": 1,
  "type": "investigative",
  "requires": [
    "mission.msr02_registry_report"
  ],
  "objectives": [
    {
      "id": "reach_ferrum",
      "type": "event",
      "event": "flight.entered_region",
      "region": "ferrum"
    },
    {
      "id": "discover",
      "type": "event",
      "event": "scan.discovery_completed",
      "discovery": "ferrum_anomaly"
    },
    {
      "id": "collect",
      "type": "evidence_acquired",
      "evidence": "evidence.ferrum_scan_anomaly"
    }
  ],
  "success_effects": [
    {
      "type": "mission.advance",
      "target": "mission.msr04_nova_interpretation"
    }
  ]
}