{
  "id": "mission.msr01_convoy_irregularity",
  "version": 1,
  "type": "investigative",
  "start": {
    "dialogue": "dlg.solaris.lena.convoy_start"
  },
  "objectives": [
    {
      "id": "accept",
      "type": "dialogue_completed",
      "target": "dlg.solaris.lena.convoy_start"
    },
    {
      "id": "inspect_route",
      "type": "event",
      "event": "flight.entered_region",
      "conditions": [
        {
          "fact": "mission.msr01_convoy_irregularity",
          "equals": "active"
        }
      ]
    },
    {
      "id": "identify_correction",
      "type": "evidence_acquired",
      "evidence": "evidence.route_correction_unsigned"
    },
    {
      "id": "return_lena",
      "type": "dialogue_completed",
      "target": "dlg.solaris.lena.route_irregularity"
    }
  ],
  "success_effects": [
    {
      "type": "mission.advance",
      "target": "mission.msr02_registry_report"
    }
  ]
}