{
  "id": "mission.msr05_sigma_signal",
  "version": 1,
  "type": "main_story",
  "requires": [
    "evidence.cross_source_pattern"
  ],
  "start": {
    "dialogue": "dlg.nova.next_lead"
  },
  "objectives": [
    {
      "id": "receive_lead",
      "type": "dialogue_completed",
      "target": "dlg.nova.next_lead"
    }
  ],
  "success_effects": [
    {
      "type": "story.flag.set",
      "id": "story.msr_vertical_slice_complete"
    }
  ]
}